{
  "$schema": "https://json-schema.org/draft/2020-12/schema",
  "type": "object",
  "properties": {
    "schema_version": {
      "const": "opsec-1.0"
    },
    "producer": {
      "type": "object",
      "properties": {
        "name": {
          "type": "string",
          "minLength": 1,
          "maxLength": 256
        },
        "version": {
          "type": "string",
          "minLength": 1,
          "maxLength": 64
        },
        "ruleset": {
          "type": "string",
          "minLength": 1,
          "maxLength": 256
        }
      },
      "required": [
        "name",
        "version",
        "ruleset"
      ],
      "additionalProperties": false
    },
    "run": {
      "type": "object",
      "properties": {
        "id": {
          "type": "string",
          "minLength": 1,
          "maxLength": 256
        },
        "scope": {
          "type": "string",
          "minLength": 1,
          "maxLength": 1024
        },
        "observed_at": {
          "type": "string",
          "pattern": "^\\d{4}-\\d{2}-\\d{2}T\\d{2}:\\d{2}:\\d{2}(?:\\.\\d{1,6})?Z$"
        },
        "synthetic": {
          "type": "boolean"
        }
      },
      "required": [
        "id",
        "scope",
        "observed_at",
        "synthetic"
      ],
      "additionalProperties": false
    },
    "coverage_complete": {
      "type": "boolean"
    },
    "summary": {
      "type": "object",
      "properties": {
        "pass": {
          "type": "integer",
          "minimum": 0,
          "maximum": 10000
        },
        "fail": {
          "type": "integer",
          "minimum": 0,
          "maximum": 10000
        },
        "not_tested": {
          "type": "integer",
          "minimum": 0,
          "maximum": 10000
        },
        "not_applicable": {
          "type": "integer",
          "minimum": 0,
          "maximum": 10000
        }
      },
      "required": [
        "pass",
        "fail",
        "not_tested",
        "not_applicable"
      ],
      "additionalProperties": false
    },
    "results": {
      "type": "array",
      "maxItems": 10000,
      "items": {
        "type": "object",
        "properties": {
          "check_id": {
            "type": "string",
            "minLength": 1,
            "maxLength": 256
          },
          "asset_id": {
            "type": "string",
            "minLength": 1,
            "maxLength": 1024
          },
          "status": {
            "enum": [
              "pass",
              "fail",
              "not_tested",
              "not_applicable"
            ]
          },
          "severity": {
            "enum": [
              "critical",
              "high",
              "medium",
              "low",
              "info"
            ]
          },
          "message": {
            "type": "string",
            "minLength": 1,
            "maxLength": 2000
          },
          "remediation": {
            "type": "string",
            "minLength": 1,
            "maxLength": 2000
          },
          "evidence": {
            "type": "object",
            "properties": {
              "redacted": {
                "const": true
              },
              "refs": {
                "type": "array",
                "maxItems": 128,
                "uniqueItems": true,
                "items": {
                  "type": "string",
                  "minLength": 1,
                  "maxLength": 256
                }
              }
            },
            "required": [
              "redacted",
              "refs"
            ],
            "additionalProperties": false
          }
        },
        "required": [
          "check_id",
          "asset_id",
          "status",
          "severity",
          "message",
          "remediation",
          "evidence"
        ],
        "additionalProperties": false
      }
    },
    "coverage_gaps": {
      "type": "array",
      "maxItems": 10000,
      "items": {
        "type": "object",
        "properties": {
          "code": {
            "type": "string",
            "minLength": 1,
            "maxLength": 256
          },
          "message": {
            "type": "string",
            "minLength": 1,
            "maxLength": 2000
          }
        },
        "required": [
          "code",
          "message"
        ],
        "additionalProperties": false
      }
    }
  },
  "required": [
    "schema_version",
    "producer",
    "run",
    "coverage_complete",
    "summary",
    "results",
    "coverage_gaps"
  ],
  "additionalProperties": false
}
